{
  "$schema": "http://json-schema.org/draft-07/schema#",
  "$ref": "#/definitions/PipelineAdoptionEnvelope",
  "definitions": {
    "PipelineAdoptionEnvelope": {
      "type": "object",
      "properties": {
        "schema": {
          "type": "string",
          "const": "sentinel-pipeline-adoption/draft-1"
        },
        "workspaceIdentity": {
          "$ref": "#/definitions/Digest"
        },
        "workspacePath": {
          "type": "string",
          "description": "The canonical workspace path, recorded for the owner to read; the identity is what is compared.",
          "maxLength": 4096
        },
        "pipelineId": {
          "$ref": "#/definitions/Id"
        },
        "revision": {
          "$ref": "#/definitions/Ordinal"
        },
        "fileDigest": {
          "$ref": "#/definitions/Digest"
        },
        "packs": {
          "type": "array",
          "items": {
            "$ref": "#/definitions/PipelinePackPin"
          },
          "maxItems": 256
        },
        "digest": {
          "$ref": "#/definitions/Digest"
        },
        "receipt": {
          "$ref": "#/definitions/Digest",
          "description": "The spent owner receipt that confirmed it."
        },
        "adoptedAt": {
          "$ref": "#/definitions/Timestamp"
        }
      },
      "required": [
        "schema",
        "workspaceIdentity",
        "workspacePath",
        "pipelineId",
        "revision",
        "fileDigest",
        "packs",
        "digest",
        "receipt",
        "adoptedAt"
      ],
      "additionalProperties": false,
      "description": "sentinel-pipeline-adoption/draft-1 — the owner's adoption of one pipeline for one workspace, kept in the owner's trust folder outside every checkout. `digest` covers the pipeline file's bytes and every pinned pack's bytes; a changed byte in either is no longer adopted."
    },
    "Digest": {
      "type": "string",
      "description": "A SHA-256 content address, lower-case hex.",
      "pattern": "^sha256:[0-9a-f]{64}$"
    },
    "Id": {
      "type": "string",
      "description": "A ledger identifier. Opaque, bounded and free of path separators and whitespace.",
      "pattern": "^[A-Za-z0-9][A-Za-z0-9._:-]*$",
      "maxLength": 128
    },
    "Ordinal": {
      "type": "integer",
      "description": "A positive integer ordinal or revision.",
      "minimum": 1,
      "maximum": 2147483647
    },
    "PipelinePackPin": {
      "type": "object",
      "properties": {
        "ref": {
          "$ref": "#/definitions/PackRef"
        },
        "digest": {
          "$ref": "#/definitions/Digest"
        }
      },
      "required": [
        "ref",
        "digest"
      ],
      "additionalProperties": false,
      "description": "One stage or skill pack a pipeline names, by the digest of its referenced bytes at adoption."
    },
    "PackRef": {
      "type": "string",
      "description": "A file inside a promoted stage pack, `stages/<id>@<revision>#<file>`, or a whole skill pack, `skills/<id>@<revision>`. The pipeline's digest covers the referenced bytes, so a changed prompt is a new pipeline.",
      "pattern": "^(stages|skills)/[a-z0-9][a-z0-9-]{0,63}@[1-9][0-9]{0,8}(#[A-Za-z0-9][A-Za-z0-9._-]{0,127}(/[A-Za-z0-9][A-Za-z0-9._-]{0,127}){0,7})?$",
      "maxLength": 512
    },
    "Timestamp": {
      "type": "string",
      "description": "A UTC RFC 3339 timestamp with an explicit Z offset and a real calendar date (no leap second), years 0000–9999 proleptic Gregorian, up to nine fractional digits. The pattern bounds each field; the `date-time` format check refuses a day the month does not have. Comparisons keep all nine digits.",
      "pattern": "^[0-9]{4}-(0[1-9]|1[0-2])-(0[1-9]|[12][0-9]|3[01])T([01][0-9]|2[0-3]):[0-5][0-9]:[0-5][0-9](\\.[0-9]{1,9})?Z$",
      "format": "date-time"
    }
  },
  "$id": "https://github.com/zalos/farsight/packages/sentinel/schemas/sentinel-pipeline-adoption.draft-1.schema.json",
  "title": "sentinel-pipeline-adoption/draft-1"
}
