{
  "schema": "sentinel-pipeline-adoption/draft-1",
  "workspaceIdentity": "sha256:1111111111111111111111111111111111111111111111111111111111111111",
  "workspacePath": "/workspace/app",
  "pipelineId": "default",
  "revision": 8,
  "fileDigest": "sha256:2222222222222222222222222222222222222222222222222222222222222222",
  "packs": [
    { "ref": "stages/review@3#prompt.md", "digest": "sha256:3333333333333333333333333333333333333333333333333333333333333333" },
    { "ref": "skills/owasp-top10@2", "digest": "sha256:4444444444444444444444444444444444444444444444444444444444444444" }
  ],
  "digest": "sha256:5555555555555555555555555555555555555555555555555555555555555555",
  "receipt": "sha256:6666666666666666666666666666666666666666666666666666666666666666",
  "adoptedAt": "2026-10-27T21:00:00Z"
}
